<?xml version="1.0" encoding="UTF-8" standalone="yes"?>
<BpelStoModelConfiguration xmlns="http://sm.com/bpel/stomodel-config"
                           xmlns:xsi="http://www.w3.org/2001/XMLSchema-instance"
                           xsi:schemaLocation="http://sm.com/bpel/stomodel-config src/bpel-stomodel-config.xsd">
    <ActivityConfig>
        <activityName>Receive1</activityName>
        <TimeDistribution>
            <time>1</time>
            <probability>0.98</probability>
        </TimeDistribution>
        <TimeDistribution>
            <time>2</time>
            <probability>0.01</probability>
        </TimeDistribution>
        <TimeDistribution>
            <time>3</time>
            <probability>0.01</probability>
        </TimeDistribution>
    </ActivityConfig>
    <ActivityConfig>
        <activityName>Assign1</activityName>
        <TimeDistribution>
            <time>3</time>
            <probability>0.98</probability>
        </TimeDistribution>
        <TimeDistribution>
            <time>1</time>
            <probability>0.01</probability>
        </TimeDistribution>
        <TimeDistribution>
            <time>2</time>
            <probability>0.01</probability>
        </TimeDistribution>
    </ActivityConfig>
    
</BpelStoModelConfiguration>