<?xml version="1.0" encoding="UTF-8" standalone="yes"?>
<BpelStoModelConfiguration xmlns="http://sm.com/bpel/stomodel-config"
                           xmlns:xsi="http://www.w3.org/2001/XMLSchema-instance"
                           xsi:schemaLocation="http://sm.com/bpel/stomodel-config src/bpel-stomodel-config.xsd">
    <ActivityConfig>
        <activityName>Invoke0</activityName>
        <TimeDistribution>
            <time>1</time>
            <probability>0.98</probability>
        </TimeDistribution>
        <TimeDistribution>
            <time>2</time>
            <probability>0.01</probability>
        </TimeDistribution>
        <TimeDistribution>
            <time>3</time>
            <probability>0.01</probability>
        </TimeDistribution>
    </ActivityConfig>
    <ActivityConfig>
        <activityName>Invoke1</activityName>
        <TimeDistribution>
            <time>1</time>
            <probability>0.98</probability>
        </TimeDistribution>
        <TimeDistribution>
            <time>2</time>
            <probability>0.01</probability>
        </TimeDistribution>
        <TimeDistribution>
            <time>3</time>
            <probability>0.01</probability>
        </TimeDistribution>
    </ActivityConfig>
    <ActivityConfig>
        <activityName>Invoke2</activityName>
        <TimeDistribution>
            <time>1</time>
            <probability>0.98</probability>
        </TimeDistribution>
        <TimeDistribution>
            <time>2</time>
            <probability>0.01</probability>
        </TimeDistribution>
        <TimeDistribution>
            <time>3</time>
            <probability>0.01</probability>
        </TimeDistribution>
    </ActivityConfig>
    <ActivityConfig>
        <activityName>InvokeM</activityName>
        <TimeDistribution>
            <time>1</time>
            <probability>0.98</probability>
        </TimeDistribution>
        <TimeDistribution>
            <time>2</time>
            <probability>0.01</probability>
        </TimeDistribution>
        <TimeDistribution>
            <time>3</time>
            <probability>0.01</probability>
        </TimeDistribution>
    </ActivityConfig>
    <ActivityConfig>
        <activityName>InvokeN</activityName>
        <TimeDistribution>
            <time>1</time>
            <probability>0.98</probability>
        </TimeDistribution>
        <TimeDistribution>
            <time>2</time>
            <probability>0.01</probability>
        </TimeDistribution>
        <TimeDistribution>
            <time>3</time>
            <probability>0.01</probability>
        </TimeDistribution>
    </ActivityConfig>
    <ActivityConfig>
        <activityName>InvNp1</activityName>
        <TimeDistribution>
            <time>1</time>
            <probability>0.98</probability>
        </TimeDistribution>
        <TimeDistribution>
            <time>2</time>
            <probability>0.01</probability>
        </TimeDistribution>
        <TimeDistribution>
            <time>3</time>
            <probability>0.01</probability>
        </TimeDistribution>
    </ActivityConfig>
    <IfActivityConfig>
        <activityName>If1</activityName>
        <probabilityOfBranch>0.25</probabilityOfBranch>
    </IfActivityConfig>
    <IfActivityConfig>
        <activityName>If2</activityName>
        <probabilityOfBranch>0.33</probabilityOfBranch>
    </IfActivityConfig>
    <IfActivityConfig>
        <activityName>IfM</activityName>
        <probabilityOfBranch>0.5</probabilityOfBranch>
    </IfActivityConfig>
    <FlowActivityConfig>
        <activityName>Flow1</activityName>
        <countOfWaitedResults>2</countOfWaitedResults>
    </FlowActivityConfig>
</BpelStoModelConfiguration>